{
  "graph_id": "graph-code-mode",
  "created_at": "2026-02-26T00:00:00.000000Z",
  "title": "Code Mode Implementation — Deterministic Multi-Agent Execution Kernel + Visual Swarm Control Plane",
  "nodes": [
    {
      "task_id": "CM-K001",
      "title": "Add CodeEvent.schema.json + event type enum",
      "blocked_by": [],
      "wih_path": "/.allternit/wih/CM-K001.wih.json"
    },
    {
      "task_id": "CM-K002",
      "title": "Validate Receipt.schema.json covers Code Mode requirements",
      "blocked_by": [],
      "wih_path": "/.allternit/wih/CM-K002.wih.json"
    },
    {
      "task_id": "CM-K003",
      "title": "Implement UI gateway route contracts (UIRegistry, UIAction, UINav, UIWorkspaceLayout)",
      "blocked_by": [],
      "wih_path": "/.allternit/wih/CM-K003.wih.json"
    },
    {
      "task_id": "CM-UI001",
      "title": "Implement Code Mode 3-pane layout container in ShellUI",
      "blocked_by": ["CM-K003"],
      "wih_path": "/.allternit/wih/CM-UI001.wih.json"
    },
    {
      "task_id": "CM-UI002",
      "title": "Workspace selector + repo status chip",
      "blocked_by": ["CM-UI001"],
      "wih_path": "/.allternit/wih/CM-UI002.wih.json"
    },
    {
      "task_id": "CM-UI003",
      "title": "Session list UI with mode/state/isolation chips",
      "blocked_by": ["CM-UI001", "CM-K001"],
      "wih_path": "/.allternit/wih/CM-UI003.wih.json"
    },
    {
      "task_id": "CM-UI010",
      "title": "PlanCard renderer (goal, files, steps, risk, rollback, verification)",
      "blocked_by": ["CM-UI003"],
      "wih_path": "/.allternit/wih/CM-UI010.wih.json"
    },
    {
      "task_id": "CM-UI011",
      "title": "Plan approval flow (Approve/Reject/Edit transitions)",
      "blocked_by": ["CM-UI010", "CM-K001"],
      "wih_path": "/.allternit/wih/CM-UI011.wih.json"
    },
    {
      "task_id": "CM-UI020",
      "title": "ChangeSetCard (summary, status, base commit, actions_required)",
      "blocked_by": ["CM-UI003"],
      "wih_path": "/.allternit/wih/CM-UI020.wih.json"
    },
    {
      "task_id": "CM-UI021",
      "title": "DiffReview view (file list + unified diff + hunks)",
      "blocked_by": ["CM-UI020"],
      "wih_path": "/.allternit/wih/CM-UI021.wih.json"
    },
    {
      "task_id": "CM-UI022",
      "title": "ChangeSet approval/apply/reject with policy gating",
      "blocked_by": ["CM-UI021", "CM-UI030"],
      "wih_path": "/.allternit/wih/CM-UI022.wih.json"
    },
    {
      "task_id": "CM-UI023",
      "title": "Comment-on-diff → ChangeSet revision loop",
      "blocked_by": ["CM-UI021"],
      "wih_path": "/.allternit/wih/CM-UI023.wih.json"
    },
    {
      "task_id": "CM-UI024",
      "title": "Revert applied ChangeSet",
      "blocked_by": ["CM-UI022"],
      "wih_path": "/.allternit/wih/CM-UI024.wih.json"
    },
    {
      "task_id": "CM-UI030",
      "title": "ActionApprovalCard (shell/test/build/git/network permission prompts)",
      "blocked_by": ["CM-UI003", "CM-K031"],
      "wih_path": "/.allternit/wih/CM-UI030.wih.json"
    },
    {
      "task_id": "CM-K031",
      "title": "Non-bypassable approval tokens (Rails issues → Runner presents)",
      "blocked_by": ["CM-K001", "CM-K002"],
      "wih_path": "/.allternit/wih/CM-K031.wih.json"
    },
    {
      "task_id": "CM-UI032",
      "title": "Allow-always writes policy override from UI",
      "blocked_by": ["CM-UI030"],
      "wih_path": "/.allternit/wih/CM-UI032.wih.json"
    },
    {
      "task_id": "CM-UI040",
      "title": "SessionInspector right pane (mode/state/plan/policy/files/receipts)",
      "blocked_by": ["CM-UI003", "CM-UI010", "CM-UI020"],
      "wih_path": "/.allternit/wih/CM-UI040.wih.json"
    },
    {
      "task_id": "CM-UI041",
      "title": "Receipts drilldown viewer",
      "blocked_by": ["CM-UI040", "CM-K002"],
      "wih_path": "/.allternit/wih/CM-UI041.wih.json"
    },
    {
      "task_id": "CM-K050",
      "title": "Worktree create/cleanup + scope enforcement in Runner",
      "blocked_by": ["CM-K031"],
      "wih_path": "/.allternit/wih/CM-K050.wih.json"
    },
    {
      "task_id": "CM-UI051",
      "title": "Merge flow UI: worktree PR merge vs sandbox patch apply",
      "blocked_by": ["CM-K050", "CM-UI022"],
      "wih_path": "/.allternit/wih/CM-UI051.wih.json"
    },
    {
      "task_id": "CM-K060",
      "title": "Editor bridge tool (editor.open)",
      "blocked_by": ["CM-UI021"],
      "wih_path": "/.allternit/wih/CM-K060.wih.json"
    },
    {
      "task_id": "CM-K061",
      "title": "Preview session manager (dev server/ports/stop)",
      "blocked_by": ["CM-K050"],
      "wih_path": "/.allternit/wih/CM-K061.wih.json"
    }
  ],
  "edges": [
    {"from": "CM-K003", "to": "CM-UI001"},
    {"from": "CM-UI001", "to": "CM-UI002"},
    {"from": "CM-UI001", "to": "CM-UI003"},
    {"from": "CM-K001", "to": "CM-UI003"},
    {"from": "CM-UI003", "to": "CM-UI010"},
    {"from": "CM-UI010", "to": "CM-UI011"},
    {"from": "CM-K001", "to": "CM-UI011"},
    {"from": "CM-UI003", "to": "CM-UI020"},
    {"from": "CM-UI020", "to": "CM-UI021"},
    {"from": "CM-UI021", "to": "CM-UI022"},
    {"from": "CM-UI030", "to": "CM-UI022"},
    {"from": "CM-UI021", "to": "CM-UI023"},
    {"from": "CM-UI022", "to": "CM-UI024"},
    {"from": "CM-UI003", "to": "CM-UI030"},
    {"from": "CM-K031", "to": "CM-UI030"},
    {"from": "CM-UI030", "to": "CM-UI032"},
    {"from": "CM-K001", "to": "CM-K031"},
    {"from": "CM-K002", "to": "CM-K031"},
    {"from": "CM-UI003", "to": "CM-UI040"},
    {"from": "CM-UI010", "to": "CM-UI040"},
    {"from": "CM-UI020", "to": "CM-UI040"},
    {"from": "CM-UI040", "to": "CM-UI041"},
    {"from": "CM-K002", "to": "CM-UI041"},
    {"from": "CM-K031", "to": "CM-K050"},
    {"from": "CM-K050", "to": "CM-UI051"},
    {"from": "CM-UI022", "to": "CM-UI051"},
    {"from": "CM-UI021", "to": "CM-K060"},
    {"from": "CM-K050", "to": "CM-K061"}
  ]
}