{
  "graph_id": "graph-0002",
  "created_at": "2026-01-27T04:49:15.523225Z",
  "title": "A2R Gateway + Router + UI Cockpit",
  "nodes": [
    {
      "task_id": "G0100",
      "title": "Design Gateway contract + request envelope",
      "blocked_by": [],
      "wih_path": "/.a2r/wih/G0100.wih.json"
    },
    {
      "task_id": "G0101",
      "title": "Implement gateway config generator (env profiles)",
      "blocked_by": [
        "G0100"
      ],
      "wih_path": "/.a2r/wih/G0101.wih.json"
    },
    {
      "task_id": "G0102",
      "title": "Service discovery: name-based internal routing spec",
      "blocked_by": [
        "G0100"
      ],
      "wih_path": "/.a2r/wih/G0102.wih.json"
    },
    {
      "task_id": "G0103",
      "title": "Local dev transport plan: UDS + loopback constraints",
      "blocked_by": [
        "G0102"
      ],
      "wih_path": "/.a2r/wih/G0103.wih.json"
    },
    {
      "task_id": "G0104",
      "title": "Refactor port sprawl: centralize ports to generated config",
      "blocked_by": [
        "G0101",
        "G0102"
      ],
      "wih_path": "/.a2r/wih/G0104.wih.json"
    },
    {
      "task_id": "G0105",
      "title": "Gateway authZ: workspace/session scoped tokens",
      "blocked_by": [
        "G0100"
      ],
      "wih_path": "/.a2r/wih/G0105.wih.json"
    },
    {
      "task_id": "G0200",
      "title": "Routing policy contract: model allowlists, caps, budgets",
      "blocked_by": [],
      "wih_path": "/.a2r/wih/G0200.wih.json"
    },
    {
      "task_id": "G0201",
      "title": "Implement multi-LLM router adapter interface",
      "blocked_by": [
        "G0200"
      ],
      "wih_path": "/.a2r/wih/G0201.wih.json"
    },
    {
      "task_id": "G0202",
      "title": "Routing audit receipts (why model chosen)",
      "blocked_by": [
        "G0201"
      ],
      "wih_path": "/.a2r/wih/G0202.wih.json"
    },
    {
      "task_id": "G0203",
      "title": "Provider plugins: Claude/GPT/Gemini/local interface stubs",
      "blocked_by": [
        "G0201"
      ],
      "wih_path": "/.a2r/wih/G0203.wih.json"
    },
    {
      "task_id": "G0300",
      "title": "UI Cockpit IA: Workspace home + Today tab + global alerts",
      "blocked_by": [],
      "wih_path": "/.a2r/wih/G0300.wih.json"
    },
    {
      "task_id": "G0301",
      "title": "DAG view + node inspector requirements (WIH visible always)",
      "blocked_by": [
        "G0300"
      ],
      "wih_path": "/.a2r/wih/G0301.wih.json"
    },
    {
      "task_id": "G0302",
      "title": "Run replay UX: logs, tool timeline, filesystem diff, hashes",
      "blocked_by": [
        "G0301",
        "G0202"
      ],
      "wih_path": "/.a2r/wih/G0302.wih.json"
    },
    {
      "task_id": "G0303",
      "title": "Promotion dashboard UX: proposals, rules, diffs, rollback",
      "blocked_by": [
        "G0301"
      ],
      "wih_path": "/.a2r/wih/G0303.wih.json"
    },
    {
      "task_id": "G0304",
      "title": "Gateway integration wiring: UI and CLI only talk to gateway",
      "blocked_by": [
        "G0101",
        "G0300"
      ],
      "wih_path": "/.a2r/wih/G0304.wih.json"
    },
    {
      "task_id": "G0400",
      "title": "Optional layer spec: crypto module boundaries + contracts",
      "blocked_by": [],
      "wih_path": "/.a2r/wih/G0400.wih.json"
    },
    {
      "task_id": "G0401",
      "title": "Optional layer spec: social network module boundaries",
      "blocked_by": [
        "G0400"
      ],
      "wih_path": "/.a2r/wih/G0401.wih.json"
    }
  ],
  "edges": [
    {
      "from": "G0100",
      "to": "G0101"
    },
    {
      "from": "G0100",
      "to": "G0102"
    },
    {
      "from": "G0102",
      "to": "G0103"
    },
    {
      "from": "G0101",
      "to": "G0104"
    },
    {
      "from": "G0102",
      "to": "G0104"
    },
    {
      "from": "G0100",
      "to": "G0105"
    },
    {
      "from": "G0200",
      "to": "G0201"
    },
    {
      "from": "G0201",
      "to": "G0202"
    },
    {
      "from": "G0201",
      "to": "G0203"
    },
    {
      "from": "G0300",
      "to": "G0301"
    },
    {
      "from": "G0301",
      "to": "G0302"
    },
    {
      "from": "G0202",
      "to": "G0302"
    },
    {
      "from": "G0301",
      "to": "G0303"
    },
    {
      "from": "G0101",
      "to": "G0304"
    },
    {
      "from": "G0300",
      "to": "G0304"
    },
    {
      "from": "G0400",
      "to": "G0401"
    }
  ]
}