{
  "graph_id": "graph-0003",
  "title": "A2R Vision Glass & Governance Integration",
  "nodes": [
    {
      "task_id": "G0501",
      "title": "A2R Receipt Generation in a2r-operator",
      "blocked_by": [],
      "wih_path": "/.a2r/wih/G0501.wih.json"
    },
    {
      "task_id": "G0502",
      "title": "Rust Bridge Policy Interception",
      "blocked_by": ["G0501"],
      "wih_path": "/.a2r/wih/G0502.wih.json"
    },
    {
      "task_id": "G0503",
      "title": "Thought Trace Sidebar in Invoke Window",
      "blocked_by": [],
      "wih_path": "/.a2r/wih/G0503.wih.json"
    },
    {
      "task_id": "G0504",
      "title": "Vision Glass Transparent Overlay",
      "blocked_by": ["G0503"],
      "wih_path": "/.a2r/wih/G0504.wih.json"
    },
    {
      "task_id": "G0505",
      "title": "Vision E2E Integration",
      "blocked_by": ["G0502", "G0504"],
      "wih_path": "/.a2r/wih/G0505.wih.json"
    }
  ],
  "edges": [
    { "from": "G0501", "to": "G0502" },
    { "from": "G0503", "to": "G0504" },
    { "from": "G0502", "to": "G0505" },
    { "from": "G0504", "to": "G0505" }
  ]
}
